{
  "$schema": "http://json-schema.org/draft-07/schema#",
  "$id": "https://sfia.local/schemas/v3-modeled/decision/human-decision.schema.json",
  "title": "HumanDecision",
  "description": "Immutable sealed human decision",
  "type": "object",
  "additionalProperties": false,
  "required": [
    "decisionId",
    "decisionRequestId",
    "gateId",
    "verdict",
    "decidedAt",
    "decidedBy",
    "schemaVersion",
    "immutable"
  ],
  "properties": {
    "schemaVersion": {
      "type": "string",
      "const": "0.1.0-d1"
    },
    "decisionId": {
      "$ref": "../common/identifier.schema.json"
    },
    "decisionRequestId": {
      "$ref": "../common/identifier.schema.json"
    },
    "gateId": {
      "$ref": "../common/identifier.schema.json"
    },
    "verdict": {
      "type": "string",
      "enum": [
        "GO",
        "NO_GO",
        "DEFER"
      ]
    },
    "motif": {
      "type": "string"
    },
    "decidedAt": {
      "$ref": "../common/timestamp.schema.json"
    },
    "decidedBy": {
      "$ref": "../common/actor-reference.schema.json"
    },
    "immutable": {
      "type": "boolean",
      "const": true
    }
  }
}
